{
  "schema_version": "1.0",
  "task_id": "T-QE-VERIFY-ENVIRONMENT",
  "run_id": "run-qe-verify-environment",
  "created_at": "2026-07-29T20:25:00Z",
  "scope_ref": {
    "path": "runs/quality-engineer-boundary-test/fixture-repo-environment/scope.json"
  },
  "findings": [
    {
      "id": "F-1",
      "claim": "fixture-src/reporter.py exists as the target module for report_value(), with a module docstring establishing it as a Quality Engineer environment-failure fixture.",
      "classification": "found",
      "evidence": [
        {
          "path": "runs/quality-engineer-boundary-test/fixture-repo-environment/fixture-src/reporter.py",
          "start_line": 1,
          "end_line": 5,
          "evidence_tier": "metadata",
          "excerpt": "\"\"\"Fixture module for Quality Engineer environment-failure verification.\n\nDeliberately imports a dependency that is never installed in this environment, so the\nresulting failure is a genuine missing-dependency (environment) problem, not application logic.\n\"\"\""
        }
      ]
    }
  ],
  "open_questions": []
}
